{
  "name": "Turbopuffer",
  "links": {
    "docs": "https://turbopuffer.com/docs",
    "github": "https://github.com/sirupsen",
    "website": "http://turbopuffer.com/",
    "vendor_discussion": "https://github.com/superlinked/VectorHub/discussions/92",
    "poc_github": "https://github.com/sirupsen",
    "slug": "turbopuffer"
  },
  "oss": {
    "support": "none",
    "source_url": "",
    "comment": ""
  },
  "license": {
    "value": "Proprietary",
    "source_url": "",
    "comment": ""
  },
  "dev_languages": {
    "value": [
      "rust"
    ],
    "source_url": "",
    "comment": ""
  },
  "vector_launch_year": 2023,
  "metadata_filter": {
    "support": "full",
    "source_url": "https://turbopuffer.com/docs/reference/query",
    "comment": ""
  },
  "hybrid_search": {
    "support": "partial",
    "source_url": "https://turbopuffer.com/docs/hybrid-search",
    "comment": "Fusion not supported in-DB at the moment"
  },
  "facets": {
    "support": "none",
    "source_url": "",
    "comment": ""
  },
  "geo_search": {
    "support": "none",
    "source_url": "",
    "comment": ""
  },
  "multi_vec": {
    "support": "none",
    "source_url": "",
    "comment": ""
  },
  "sparse_vectors": {
    "support": "none",
    "source_url": "",
    "comment": ""
  },
  "bm25": {
    "support": "full",
    "source_url": "https://turbopuffer.com/docs/upsert#schema",
    "comment": ""
  },
  "full_text": {
    "support": "full",
    "source_url": "https://turbopuffer.com/docs/upsert#schema",
    "comment": ""
  },
  "embeddings_text": {
    "support": "none",
    "source_url": "",
    "comment": ""
  },
  "embeddings_image": {
    "support": "none",
    "source_url": "",
    "comment": ""
  },
  "embeddings_structured": {
    "support": "",
    "source_url": "",
    "comment": ""
  },
  "rag": {
    "support": "",
    "source_url": "",
    "comment": ""
  },
  "recsys": {
    "support": "none",
    "source_url": "",
    "comment": ""
  },
  "langchain": {
    "support": "none",
    "source_url": "",
    "comment": ""
  },
  "llamaindex": {
    "support": "none",
    "source_url": "",
    "comment": ""
  },
  "managed_cloud": {
    "support": "full",
    "source_url": "",
    "comment": ""
  },
  "pricing": {
    "value": "$1/million vecs, $4/million queries",
    "source_url": "https://turbopuffer.com/",
    "comment": ""
  },
  "in_process": {
    "support": "none",
    "source_url": "",
    "comment": ""
  },
  "multi_tenancy": {
    "support": "full",
    "source_url": "",
    "comment": ""
  },
  "disk_index": {
    "support": "",
    "source_url": "",
    "comment": ""
  },
  "ephemeral": {
    "support": "none",
    "source_url": "",
    "comment": ""
  },
  "sharding": {
    "support": "full",
    "source_url": "",
    "comment": ""
  },
  "doc_size": {
    "bytes": 65536,
    "unlimited": false,
    "source_url": "",
    "comment": ""
  },
  "vector_dims": {
    "value": 10752,
    "unlimited": false,
    "source_url": "https://turbopuffer.com/docs/get-started/limits",
    "comment": ""
  },
  "index_types": {
    "value": [
      "SPANN"
    ],
    "source_url": "https://turbopuffer.com/architecture#:~:text=on%20SPANN.-,SPANN,-is%20a%20centroid",
    "comment": ""
  },
  "github_stars": {
    "value": 0,
    "source_url": "",
    "comment": "",
    "value_90_days": 0
  },
  "docker_pulls": {
    "value": 0,
    "source_url": "",
    "comment": "",
    "value_90_days": 0
  },
  "pypi_downloads": {
    "value": 42609879,
    "source_url": "https://pypi.org/project/turbopuffer/",
    "comment": "",
    "value_90_days": 13848535
  },
  "npm_downloads": {
    "value": 21091852,
    "source_url": "https://www.npmjs.com/package/@turbopuffer/turbopuffer",
    "comment": "",
    "value_90_days": 11515238
  },
  "crates_io_downloads": {
    "value": 0,
    "source_url": "",
    "comment": "",
    "value_90_days": 0
  }
}