{
  "name": "Anari AI",
  "links": {
    "docs": "",
    "github": "https://github.com/Anari-AI",
    "website": "https://anari.ai/vector-acceleration-engine/",
    "vendor_discussion": "https://github.com/superlinked/VectorHub/discussions/99",
    "poc_github": "https://github.com/jovan-stojanovic",
    "slug": "anariai"
  },
  "oss": {
    "support": "none",
    "source_url": "",
    "comment": ""
  },
  "license": {
    "value": "Proprietary",
    "source_url": "",
    "comment": ""
  },
  "dev_languages": {
    "value": [
      ""
    ],
    "source_url": "",
    "comment": ""
  },
  "vector_launch_year": 2023,
  "metadata_filter": {
    "support": "",
    "source_url": "",
    "comment": ""
  },
  "hybrid_search": {
    "support": "none",
    "source_url": "",
    "comment": ""
  },
  "facets": {
    "support": "",
    "source_url": "",
    "comment": ""
  },
  "geo_search": {
    "support": "none",
    "source_url": "",
    "comment": ""
  },
  "multi_vec": {
    "support": "",
    "source_url": "",
    "comment": ""
  },
  "sparse_vectors": {
    "support": "",
    "source_url": "",
    "comment": ""
  },
  "bm25": {
    "support": "none",
    "source_url": "",
    "comment": ""
  },
  "full_text": {
    "support": "",
    "source_url": "",
    "comment": ""
  },
  "embeddings_text": {
    "support": "",
    "source_url": "",
    "comment": ""
  },
  "embeddings_image": {
    "support": "",
    "source_url": "",
    "comment": ""
  },
  "embeddings_structured": {
    "support": "",
    "source_url": "",
    "comment": ""
  },
  "rag": {
    "support": "",
    "source_url": "",
    "comment": ""
  },
  "recsys": {
    "support": "",
    "source_url": "",
    "comment": ""
  },
  "langchain": {
    "support": "none",
    "source_url": "",
    "comment": ""
  },
  "llamaindex": {
    "support": "none",
    "source_url": "",
    "comment": ""
  },
  "managed_cloud": {
    "support": "full",
    "source_url": "",
    "comment": ""
  },
  "pricing": {
    "value": "",
    "source_url": "",
    "comment": ""
  },
  "in_process": {
    "support": "",
    "source_url": "",
    "comment": ""
  },
  "multi_tenancy": {
    "support": "",
    "source_url": "",
    "comment": ""
  },
  "disk_index": {
    "support": "",
    "source_url": "",
    "comment": ""
  },
  "ephemeral": {
    "support": "none",
    "source_url": "",
    "comment": ""
  },
  "sharding": {
    "support": "",
    "source_url": "",
    "comment": ""
  },
  "doc_size": {
    "bytes": 0,
    "unlimited": true,
    "source_url": "",
    "comment": ""
  },
  "vector_dims": {
    "value": 0,
    "unlimited": false,
    "source_url": "",
    "comment": ""
  },
  "index_types": {
    "value": [
      "Proprietary"
    ],
    "source_url": "https://anari.ai/vector-acceleration-engine/",
    "comment": "uses FPGA"
  },
  "github_stars": {
    "value": 0,
    "source_url": "",
    "comment": "",
    "value_90_days": 0
  },
  "docker_pulls": {
    "value": 0,
    "source_url": "",
    "comment": "",
    "value_90_days": 0
  },
  "pypi_downloads": {
    "value": 0,
    "source_url": "",
    "comment": "",
    "value_90_days": 0
  },
  "npm_downloads": {
    "value": 3023,
    "source_url": "https://www.npmjs.com/package/epsillajs",
    "comment": "",
    "value_90_days": 1176
  },
  "crates_io_downloads": {
    "value": 0,
    "source_url": "",
    "comment": "",
    "value_90_days": 0
  }
}