{
  "name": "Qdrant",
  "links": {
    "docs": "https://qdrant.tech/documentation/",
    "github": "https://github.com/qdrant/qdrant",
    "website": "https://qdrant.tech/",
    "vendor_discussion": "https://github.com/superlinked/VectorHub/discussions/66",
    "poc_github": "https://github.com/atarora",
    "slug": "qdrant"
  },
  "oss": {
    "support": "full",
    "source_url": "https://github.com/qdrant/qdrant",
    "comment": ""
  },
  "license": {
    "value": "Apache-2.0",
    "source_url": "",
    "comment": ""
  },
  "dev_languages": {
    "value": [
      "rust"
    ],
    "source_url": "https://github.com/qdrant/qdrant",
    "comment": ""
  },
  "vector_launch_year": 2021,
  "metadata_filter": {
    "support": "full",
    "source_url": "https://qdrant.tech/documentation/concepts/filtering/",
    "comment": ""
  },
  "hybrid_search": {
    "support": "full",
    "source_url": "https://qdrant.tech/documentation/concepts/hybrid-queries/",
    "comment": "Supports hybrid fusion searches with dense/sparse/multi vectors"
  },
  "facets": {
    "support": "full",
    "source_url": "https://qdrant.tech/documentation/concepts/payload/?q=facet#facet-counts",
    "comment": "Supports dynamically aggregate and count unique values in fields"
  },
  "geo_search": {
    "support": "full",
    "source_url": "https://qdrant.tech/documentation/concepts/filtering/#geo",
    "comment": ""
  },
  "multi_vec": {
    "support": "full",
    "source_url": "https://qdrant.tech/documentation/concepts/vectors/#multivectors",
    "comment": ""
  },
  "sparse_vectors": {
    "support": "full",
    "source_url": "https://qdrant.tech/articles/sparse-vectors",
    "comment": ""
  },
  "bm25": {
    "support": "none",
    "source_url": "https://qdrant.tech/articles/sparse-vectors",
    "comment": ""
  },
  "full_text": {
    "support": "full",
    "source_url": "https://qdrant.tech/documentation/concepts/indexing/#full-text-index",
    "comment": ""
  },
  "embeddings_text": {
    "support": "full",
    "source_url": "https://qdrant.github.io/fastembed/examples/Supported_Models/#supported-text-embedding-models",
    "comment": "via FastEmbed (Supported models: https://qdrant.github.io/fastembed/examples/Supported_Models/#supported-text-embedding-models)"
  },
  "embeddings_image": {
    "support": "full",
    "source_url": "https://qdrant.github.io/fastembed/examples/Supported_Models/#supported-image-embedding-models",
    "comment": "via FastEmbed (Supported models: https://qdrant.github.io/fastembed/examples/Supported_Models/#supported-image-embedding-models)"
  },
  "embeddings_structured": {
    "support": "",
    "source_url": "",
    "comment": ""
  },
  "rag": {
    "support": "full",
    "source_url": "",
    "comment": ""
  },
  "recsys": {
    "support": "full",
    "source_url": "",
    "comment": ""
  },
  "langchain": {
    "support": "full",
    "source_url": "",
    "comment": ""
  },
  "llamaindex": {
    "support": "full",
    "source_url": "",
    "comment": ""
  },
  "managed_cloud": {
    "support": "full",
    "source_url": "https://cloud.qdrant.io/",
    "comment": ""
  },
  "pricing": {
    "value": "Qdrant Pricing (free tier available)",
    "source_url": "https://qdrant.tech/pricing/",
    "comment": ""
  },
  "in_process": {
    "support": "partial",
    "source_url": "",
    "comment": "only in Python SDK in-memory mode"
  },
  "multi_tenancy": {
    "support": "full",
    "source_url": "https://qdrant.tech/documentation/guides/multiple-partitions/",
    "comment": "via collections/metadata"
  },
  "disk_index": {
    "support": "full",
    "source_url": "https://qdrant.tech/documentation/concepts/storage/",
    "comment": "https://qdrant.tech/documentation/concepts/storage/#configuring-memmap-storage"
  },
  "ephemeral": {
    "support": "full",
    "source_url": "",
    "comment": ""
  },
  "sharding": {
    "support": "full",
    "source_url": "https://qdrant.tech/documentation/guides/distributed_deployment/",
    "comment": "https://qdrant.tech/documentation/guides/distributed_deployment/#user-defined-sharding"
  },
  "doc_size": {
    "bytes": 0,
    "unlimited": true,
    "source_url": "",
    "comment": ""
  },
  "vector_dims": {
    "value": 65536,
    "unlimited": false,
    "source_url": "",
    "comment": ""
  },
  "int8_quantization": {
    "support": "partial",
    "source_url": "https://qdrant.tech/articles/scalar-quantization/#scalar-quantization",
    "comment": "via Scalar Quantization of index"
  },
  "binary_quantization": {
    "support": "partial",
    "source_url": "https://qdrant.tech/documentation/guides/quantization/#binary-quantization",
    "comment": "via Binary Quantization of index"
  },
  "index_types": {
    "value": [
      "FLAT",
      "HNSW",
      "HNSW-PQ",
      "HNSW-SQ",
      "HNSW-BQ"
    ],
    "source_url": "https://qdrant.tech/documentation/concepts/indexing/",
    "comment": ""
  },
  "github_stars": {
    "value": 35253,
    "source_url": "https://github.com/qdrant/qdrant",
    "comment": "",
    "value_90_days": 0
  },
  "docker_pulls": {
    "value": 53052564,
    "source_url": "https://hub.docker.com/r/qdrant/qdrant",
    "comment": "",
    "value_90_days": 0
  },
  "pypi_downloads": {
    "value": 273293805,
    "source_url": "https://pypi.org/project/qdrant-client/",
    "comment": "",
    "value_90_days": 43551732
  },
  "npm_downloads": {
    "value": 1315891,
    "source_url": "https://www.npmjs.com/~qdrant-tech",
    "comment": "Total downloads of the REST and gRPC packages",
    "value_90_days": 551308
  },
  "crates_io_downloads": {
    "value": 2491148,
    "source_url": "https://crates.io/crates/qdrant-client",
    "comment": "",
    "value_90_days": 359185
  }
}