{
  "name": "OramaSearch",
  "links": {
    "docs": "https://docs.oramasearch.com/open-source/",
    "github": "https://github.com/oramasearch/orama",
    "website": "http://oramasearch.com/",
    "vendor_discussion": "https://github.com/superlinked/VectorHub/discussions/82",
    "poc_github": "https://github.com/MicheleRiva",
    "slug": "oramasearch"
  },
  "oss": {
    "support": "full",
    "source_url": "",
    "comment": ""
  },
  "license": {
    "value": "Apache-2.0",
    "source_url": "",
    "comment": ""
  },
  "dev_languages": {
    "value": [
      "typescript"
    ],
    "source_url": "",
    "comment": ""
  },
  "vector_launch_year": 2022,
  "metadata_filter": {
    "support": "full",
    "source_url": "",
    "comment": ""
  },
  "hybrid_search": {
    "support": "none",
    "source_url": "",
    "comment": ""
  },
  "facets": {
    "support": "full",
    "source_url": "",
    "comment": ""
  },
  "geo_search": {
    "support": "full",
    "source_url": "",
    "comment": ""
  },
  "multi_vec": {
    "support": "none",
    "source_url": "",
    "comment": ""
  },
  "sparse_vectors": {
    "support": "none",
    "source_url": "",
    "comment": ""
  },
  "bm25": {
    "support": "full",
    "source_url": "",
    "comment": ""
  },
  "full_text": {
    "support": "full",
    "source_url": "",
    "comment": ""
  },
  "embeddings_text": {
    "support": "full",
    "source_url": "",
    "comment": ""
  },
  "embeddings_image": {
    "support": "",
    "source_url": "",
    "comment": ""
  },
  "embeddings_structured": {
    "support": "",
    "source_url": "",
    "comment": ""
  },
  "rag": {
    "support": "",
    "source_url": "",
    "comment": ""
  },
  "recsys": {
    "support": "",
    "source_url": "",
    "comment": ""
  },
  "langchain": {
    "support": "none",
    "source_url": "",
    "comment": ""
  },
  "llamaindex": {
    "support": "none",
    "source_url": "",
    "comment": ""
  },
  "managed_cloud": {
    "support": "full",
    "source_url": "",
    "comment": ""
  },
  "pricing": {
    "value": "free plan / $4.99 per month (pro)",
    "source_url": "https://oramasearch.com/pricing",
    "comment": ""
  },
  "in_process": {
    "support": "full",
    "source_url": "https://github.com/askorama/orama#installation",
    "comment": "Orama can work completely in-memory in your browser or server"
  },
  "multi_tenancy": {
    "support": "full",
    "source_url": "",
    "comment": ""
  },
  "disk_index": {
    "support": "full",
    "source_url": "https://github.com/oramasearch/orama/tree/main/packages/plugin-data-persistence",
    "comment": "Available via the official Data Persistence plugin"
  },
  "ephemeral": {
    "support": "full",
    "source_url": "",
    "comment": ""
  },
  "sharding": {
    "support": "",
    "source_url": "",
    "comment": "Cloud solution only"
  },
  "doc_size": {
    "bytes": 0,
    "unlimited": false,
    "source_url": "",
    "comment": ""
  },
  "vector_dims": {
    "value": 0,
    "unlimited": true,
    "source_url": "",
    "comment": ""
  },
  "github_stars": {
    "value": 10574,
    "source_url": "https://github.com/oramasearch/orama",
    "comment": "",
    "value_90_days": 0
  },
  "docker_pulls": {
    "value": 0,
    "source_url": "",
    "comment": "",
    "value_90_days": 0
  },
  "pypi_downloads": {
    "value": 0,
    "source_url": "",
    "comment": "",
    "value_90_days": 0
  },
  "npm_downloads": {
    "value": 37212843,
    "source_url": "https://www.npmjs.com/package/@orama/orama",
    "comment": "",
    "value_90_days": 16072231
  },
  "crates_io_downloads": {
    "value": 0,
    "source_url": "",
    "comment": "",
    "value_90_days": 0
  }
}