{
  "name": "Apache Solr",
  "links": {
    "docs": "https://solr.apache.org/guide/solr/latest/query-guide/dense-vector-search.html",
    "github": "https://github.com/apache/solr",
    "website": "https://solr.apache.org/guide/solr/latest/query-guide/dense-vector-search.html#usage-as-re-ranking-query",
    "vendor_discussion": "https://github.com/superlinked/VectorHub/discussions/78",
    "poc_github": "https://github.com/alessandrobenedetti",
    "slug": "apachesolr"
  },
  "oss": {
    "support": "full",
    "source_url": "",
    "comment": ""
  },
  "license": {
    "value": "Apache-2.0",
    "source_url": "",
    "comment": ""
  },
  "dev_languages": {
    "value": [
      "java"
    ],
    "source_url": "",
    "comment": ""
  },
  "vector_launch_year": 2022,
  "metadata_filter": {
    "support": "full",
    "source_url": "https://solr.apache.org/guide/solr/latest/query-guide/dense-vector-search.html",
    "comment": "https://solr.apache.org/guide/solr/latest/query-guide/dense-vector-search.html#usage-with-filter-queries"
  },
  "hybrid_search": {
    "support": "full",
    "source_url": "https://sease.io/2023/10/apache-lucene-solr-ai-roadmap-do-you-want-to-make-it-happen.html",
    "comment": "https://sease.io/2023/10/apache-lucene-solr-ai-roadmap-do-you-want-to-make-it-happen.html linear combination implemented"
  },
  "facets": {
    "support": "full",
    "source_url": "",
    "comment": ""
  },
  "geo_search": {
    "support": "full",
    "source_url": "",
    "comment": ""
  },
  "multi_vec": {
    "support": "full",
    "source_url": "",
    "comment": ""
  },
  "sparse_vectors": {
    "support": "",
    "source_url": "",
    "comment": ""
  },
  "bm25": {
    "support": "full",
    "source_url": "",
    "comment": ""
  },
  "full_text": {
    "support": "full",
    "source_url": "",
    "comment": ""
  },
  "embeddings_text": {
    "support": "none",
    "source_url": "",
    "comment": ""
  },
  "embeddings_image": {
    "support": "none",
    "source_url": "",
    "comment": ""
  },
  "embeddings_structured": {
    "support": "",
    "source_url": "",
    "comment": ""
  },
  "rag": {
    "support": "none",
    "source_url": "",
    "comment": ""
  },
  "recsys": {
    "support": "full",
    "source_url": "",
    "comment": ""
  },
  "langchain": {
    "support": "",
    "source_url": "https://pypi.org/project/eurelis-langchain-solr-vectorstore/",
    "comment": "https://pypi.org/project/eurelis-langchain-solr-vectorstore/"
  },
  "llamaindex": {
    "support": "none",
    "source_url": "",
    "comment": ""
  },
  "managed_cloud": {
    "support": "full",
    "source_url": "https://www.searchstax.com/lp/managed-solr-search",
    "comment": "via https://www.searchstax.com/lp/managed-solr-search and https://bonsai.io"
  },
  "pricing": {
    "value": "",
    "source_url": "",
    "comment": ""
  },
  "in_process": {
    "support": "partial",
    "source_url": "https://solr.apache.org/docs/9_4_0/core/org/apache/solr/client/solrj/embedded/EmbeddedSolrServer.html",
    "comment": "Available via EmbeddedSolrServer for Java apps only"
  },
  "multi_tenancy": {
    "support": "full",
    "source_url": "",
    "comment": ""
  },
  "disk_index": {
    "support": "",
    "source_url": "",
    "comment": ""
  },
  "ephemeral": {
    "support": "none",
    "source_url": "",
    "comment": ""
  },
  "sharding": {
    "support": "full",
    "source_url": "",
    "comment": ""
  },
  "doc_size": {
    "bytes": 0,
    "unlimited": true,
    "source_url": "",
    "comment": ""
  },
  "vector_dims": {
    "value": 0,
    "unlimited": true,
    "source_url": "https://issues.apache.org/jira/browse/SOLR-16836",
    "comment": ""
  },
  "index_types": {
    "value": [
      "FLAT",
      "HNSW"
    ],
    "source_url": "https://solr.apache.org/guide/solr/latest/query-guide/dense-vector-search.html",
    "comment": "via Lucene"
  },
  "github_stars": {
    "value": 1691,
    "source_url": "https://github.com/apache/solr",
    "comment": "",
    "value_90_days": 0
  },
  "docker_pulls": {
    "value": 357824361,
    "source_url": "https://hub.docker.com/_/solr",
    "comment": "",
    "value_90_days": 0
  },
  "pypi_downloads": {
    "value": 20333497,
    "source_url": "https://pypi.org/project/pysolr/",
    "comment": "",
    "value_90_days": 1065402
  },
  "npm_downloads": {
    "value": 455327,
    "source_url": "https://www.npmjs.com/package/solr-client",
    "comment": "",
    "value_90_days": 80382
  },
  "crates_io_downloads": {
    "value": 2355,
    "source_url": "https://crates.io/crates/solr",
    "comment": "",
    "value_90_days": 6
  }
}