{
  "name": "Apache Cassandra",
  "links": {
    "docs": "https://cassandra.apache.org/doc/latest/cassandra/vector-search/overview.html",
    "github": "https://github.com/apache/cassandra",
    "website": "https://cassandra.apache.org/_/Apache-Cassandra-5.0-Moving-Toward-an-AI-Driven-Future.html",
    "vendor_discussion": "https://github.com/superlinked/VectorHub/discussions/84",
    "poc_github": "https://github.com/jbellis",
    "slug": "apachecassandra"
  },
  "oss": {
    "support": "full",
    "source_url": "",
    "comment": ""
  },
  "license": {
    "value": "Apache-2.0",
    "source_url": "",
    "comment": ""
  },
  "dev_languages": {
    "value": [
      "java"
    ],
    "source_url": "",
    "comment": ""
  },
  "vector_launch_year": 2023,
  "metadata_filter": {
    "support": "full",
    "source_url": "",
    "comment": "via CassIO"
  },
  "hybrid_search": {
    "support": "full",
    "source_url": "https://cassio.org/",
    "comment": "via CassIO"
  },
  "facets": {
    "support": "",
    "source_url": "",
    "comment": ""
  },
  "geo_search": {
    "support": "",
    "source_url": "",
    "comment": ""
  },
  "multi_vec": {
    "support": "",
    "source_url": "",
    "comment": ""
  },
  "sparse_vectors": {
    "support": "none",
    "source_url": "",
    "comment": ""
  },
  "bm25": {
    "support": "",
    "source_url": "",
    "comment": ""
  },
  "full_text": {
    "support": "none",
    "source_url": "",
    "comment": ""
  },
  "embeddings_text": {
    "support": "",
    "source_url": "",
    "comment": ""
  },
  "embeddings_image": {
    "support": "",
    "source_url": "",
    "comment": ""
  },
  "embeddings_structured": {
    "support": "",
    "source_url": "",
    "comment": ""
  },
  "rag": {
    "support": "",
    "source_url": "",
    "comment": ""
  },
  "recsys": {
    "support": "",
    "source_url": "",
    "comment": ""
  },
  "langchain": {
    "support": "",
    "source_url": "",
    "comment": ""
  },
  "llamaindex": {
    "support": "",
    "source_url": "",
    "comment": ""
  },
  "managed_cloud": {
    "support": "",
    "source_url": "",
    "comment": ""
  },
  "pricing": {
    "value": "",
    "source_url": "",
    "comment": ""
  },
  "in_process": {
    "support": "none",
    "source_url": "",
    "comment": ""
  },
  "multi_tenancy": {
    "support": "full",
    "source_url": "",
    "comment": "via keyspaces and tables"
  },
  "disk_index": {
    "support": "full",
    "source_url": "https://cassandra.apache.org/doc/latest/cassandra/developing/cql/indexing/sai/sai-faq.html",
    "comment": "SAI index"
  },
  "ephemeral": {
    "support": "",
    "source_url": "",
    "comment": ""
  },
  "sharding": {
    "support": "",
    "source_url": "",
    "comment": ""
  },
  "doc_size": {
    "bytes": 0,
    "unlimited": false,
    "source_url": "",
    "comment": ""
  },
  "vector_dims": {
    "value": 0,
    "unlimited": true,
    "source_url": "",
    "comment": ""
  },
  "index_types": {
    "value": [
      "FLAT",
      "HNSW"
    ],
    "source_url": "https://cwiki.apache.org/confluence/display/CASSANDRA/CEP-30%3A+Approximate+Nearest+Neighbor%28ANN%29+Vector+Search+via+Storage-Attached+Indexes",
    "comment": "via Lucene"
  },
  "github_stars": {
    "value": 10129,
    "source_url": "https://github.com/apache/cassandra",
    "comment": "",
    "value_90_days": 0
  },
  "docker_pulls": {
    "value": 273259517,
    "source_url": "https://hub.docker.com/_/cassandra",
    "comment": "",
    "value_90_days": 0
  },
  "pypi_downloads": {
    "value": 221292194,
    "source_url": "https://pypi.org/project/cassandra-driver/",
    "comment": "",
    "value_90_days": 14670484
  },
  "npm_downloads": {
    "value": 13686910,
    "source_url": "https://www.npmjs.com/package/cassandra-driver",
    "comment": "",
    "value_90_days": 3912962
  },
  "crates_io_downloads": {
    "value": 106215,
    "source_url": "https://crates.io/crates/cassandra",
    "comment": "",
    "value_90_days": 30
  }
}